{
  "summary": "Credential-free validation fixture for the PlanReview output contract.",
  "deltas": {
    "add": 1,
    "change": 0,
    "destroy": 0
  },
  "risk": 10,
  "status": "GREEN",
  "rationale": "The fixture exists only to prove that the validator and schema remain executable without fabricating runtime evidence.",
  "highlights": {
    "identity": "No privileged identity is required for schema validation.",
    "keys": "No secrets or keys are included.",
    "network": "No network change is represented by this fixture.",
    "data": "Synthetic contract data only.",
    "policy": "Schema validation remains deterministic."
  },
  "controls": [
    "schema-validation",
    "non-negative-deltas"
  ],
  "rollback": "Remove the fixture if the PlanReview contract is retired.",
  "observability": "CI validates this fixture on every PlanReview workflow run.",
  "evidence": [
    "tools/planreview/fixtures/valid-summary.json"
  ],
  "uncertainty": false
}
